number,value,datetime_start,datetime_complete,duration,params_base_channels,params_batch_size,params_channel_plan,params_dropout,params_lr,params_weight_decay,user_attrs_baseline,user_attrs_best_epoch,user_attrs_duration_s,user_attrs_val_accuracy,user_attrs_val_ce,user_attrs_val_macro_f1,system_attrs_fixed_params,system_attrs_tpe:relative_params:0,state
0,0.006453831154596079,2026-09-25 14:29:14.573987,2026-09-25 14:30:46.651912,0 days 00:01:32.077925,32,64,standard,0.3,0.001,0.0001,True,9.0,92.0,0.993546187877655,0.023242797702550888,0.9935461688454039,"{'lr': 0.001, 'batch_size': 64, 'base_channels': 32, 'channel_plan': 'standard', 'dropout': 0.3, 'weight_decay': 0.0001}",,COMPLETE
1,0.006114232019598043,2026-09-25 14:30:46.829987,2026-09-25 14:31:52.560782,0 days 00:01:05.730795,16,32,shallow,0.010292247147901223,0.0003574712922600243,0.00757947995334801,,7.0,65.7,0.99388587474823,0.02582365833222866,0.993885767980402,,,COMPLETE
2,0.005774459186729808,2026-09-25 14:31:52.765089,2026-09-25 14:33:14.473300,0 days 00:01:21.708211,32,32,standard,0.14607232426760908,0.0016967533607196547,2.9204338471814107e-05,,10.0,81.6,0.9942255616188049,0.017852816730737686,0.9942255408132702,,,COMPLETE
3,0.007470099444746969,2026-09-25 14:33:14.638905,2026-09-25 14:35:33.952717,0 days 00:02:19.313812,48,32,wide_top,0.4828160165372797,0.000471705203762518,0.0017123375973163992,,7.0,139.2,0.992527186870575,0.02676154486835003,0.992529900555253,,,COMPLETE
4,0.008816444796273304,2026-09-25 14:35:34.147240,2026-09-25 14:36:40.070004,0 days 00:01:05.922764,32,64,shallow,0.15585553804470548,0.00028180680291847244,0.00012030178871154674,,,,,,,,,PRUNED
5,0.01766647050214043,2026-09-25 14:37:20.846127,2026-09-25 14:38:06.731541,0 days 00:00:45.885414,16,64,shallow,0.022613644455269033,0.000642033033629786,2.0013420622879995e-05,,,,,,,,,PRUNED
6,0.0310179465641639,2026-09-25 14:38:47.444254,2026-09-25 14:39:29.518149,0 days 00:00:42.073895,32,64,wide_top,0.3861223846483287,0.00037507963596256056,6.235377135673162e-06,,,,,,,,,PRUNED
7,0.03143024193993693,2026-09-25 14:40:10.224481,2026-09-25 14:40:48.737461,0 days 00:00:38.512980,16,32,standard,0.1654490124263246,0.0001018959297939515,1.7956984225677624e-06,,,,,,,,,PRUNED
8,0.024880622307548617,2026-09-25 14:41:29.413345,2026-09-25 14:42:07.137432,0 days 00:00:37.724087,16,64,standard,0.3854835899772805,0.0002879775265707035,9.444574254983567e-05,,,,,,,,,PRUNED
9,0.018747539321153917,2026-09-25 14:42:47.872689,2026-09-25 14:43:29.587409,0 days 00:00:41.714720,32,32,standard,0.20519146151781487,0.0005917520523090669,0.001052457468133564,,,,,,,,,PRUNED
10,0.03877230744298388,2026-09-25 14:44:10.324289,2026-09-25 14:44:51.965436,0 days 00:00:41.641147,32,32,standard,0.14388694875465796,0.0017348244091393785,0.0032308241016850946,,,,,,,,"{""base_channels"": 32, ""batch_size"": 32, ""channel_plan"": ""standard"", ""dropout"": 0.14388694875465796, ""lr"": 0.0017348244091393785, ""weight_decay"": 0.0032308241016850946}",PRUNED
11,0.0237916012447017,2026-09-25 14:45:32.677032,2026-09-25 14:46:14.216146,0 days 00:00:41.539114,32,32,standard,0.1929704152365294,0.0018218131440494974,1.1492340325497353e-06,,,,,,,,"{""base_channels"": 32, ""batch_size"": 32, ""channel_plan"": ""standard"", ""dropout"": 0.1929704152365294, ""lr"": 0.0018218131440494974, ""weight_decay"": 1.1492340325497353e-06}",PRUNED
12,0.032294743391712344,2026-09-25 14:46:54.935986,2026-09-25 14:47:32.303661,0 days 00:00:37.367675,16,32,shallow,0.07941451673884213,0.00013055195109654502,0.0013724881406193344,,,,,,,,"{""base_channels"": 16, ""batch_size"": 32, ""channel_plan"": ""shallow"", ""dropout"": 0.07941451673884213, ""lr"": 0.00013055195109654502, ""weight_decay"": 0.0013724881406193344}",PRUNED
13,0.06783891430438493,2026-09-25 14:48:13.017283,2026-09-25 14:48:54.636523,0 days 00:00:41.619240,32,32,standard,0.08252272439202238,0.002288807368460434,1.2200302020045653e-05,,,,,,,,"{""base_channels"": 32, ""batch_size"": 32, ""channel_plan"": ""standard"", ""dropout"": 0.08252272439202238, ""lr"": 0.002288807368460434, ""weight_decay"": 1.2200302020045653e-05}",PRUNED
14,0.029164848932290766,2026-09-25 14:49:35.389512,2026-09-25 14:50:16.093255,0 days 00:00:40.703743,16,32,shallow,0.11469149085793182,0.00270965669727558,0.0003286468526221282,,,,,,,,"{""base_channels"": 16, ""batch_size"": 32, ""channel_plan"": ""shallow"", ""dropout"": 0.11469149085793182, ""lr"": 0.00270965669727558, ""weight_decay"": 0.0003286468526221282}",PRUNED
15,0.026666254444917326,2026-09-25 14:50:56.795759,2026-09-25 14:51:38.674650,0 days 00:00:41.878891,32,32,standard,0.022371071943733015,0.0017197315533251237,0.0002673196344228028,,,,,,,,"{""base_channels"": 32, ""batch_size"": 32, ""channel_plan"": ""standard"", ""dropout"": 0.022371071943733015, ""lr"": 0.0017197315533251237, ""weight_decay"": 0.0002673196344228028}",PRUNED
16,0.05096016058680708,2026-09-25 14:52:19.370381,2026-09-25 14:52:57.726920,0 days 00:00:38.356539,16,32,wide_top,0.04063834596724368,0.0013930909081806067,0.0032169039373273383,,,,,,,,"{""base_channels"": 16, ""batch_size"": 32, ""channel_plan"": ""wide_top"", ""dropout"": 0.04063834596724368, ""lr"": 0.0013930909081806067, ""weight_decay"": 0.0032169039373273383}",PRUNED
17,0.02647637978045747,2026-09-25 14:53:38.451996,2026-09-25 14:54:15.747176,0 days 00:00:37.295180,16,32,shallow,0.007156991389034115,0.00014465711188012284,1.3848627395544856e-05,,,,,,,,"{""base_channels"": 16, ""batch_size"": 32, ""channel_plan"": ""shallow"", ""dropout"": 0.007156991389034115, ""lr"": 0.00014465711188012284, ""weight_decay"": 1.3848627395544856e-05}",PRUNED
18,0.03351530149483484,2026-09-25 14:54:56.446449,2026-09-25 14:55:46.911758,0 days 00:00:50.465309,48,32,standard,0.22347962812803496,0.0028321510719791433,8.240930998427144e-06,,,,,,,,"{""base_channels"": 48, ""batch_size"": 32, ""channel_plan"": ""standard"", ""dropout"": 0.22347962812803496, ""lr"": 0.0028321510719791433, ""weight_decay"": 8.240930998427144e-06}",PRUNED
19,0.006797176646010983,2026-09-25 14:56:27.609753,2026-09-25 14:57:24.766919,0 days 00:00:57.157166,16,32,shallow,0.08484079857453987,0.0003074265605213468,0.00015420587820675767,,,,,,,,"{""base_channels"": 16, ""batch_size"": 32, ""channel_plan"": ""shallow"", ""dropout"": 0.08484079857453987, ""lr"": 0.0003074265605213468, ""weight_decay"": 0.00015420587820675767}",PRUNED
20,0.01431583710779094,2026-09-25 14:58:05.459366,2026-09-25 14:58:46.885091,0 days 00:00:41.425725,16,32,shallow,0.14003554952628575,0.0010259393678704039,0.00019562160424025995,,,,,,,,"{""base_channels"": 16, ""batch_size"": 32, ""channel_plan"": ""shallow"", ""dropout"": 0.14003554952628575, ""lr"": 0.0010259393678704039, ""weight_decay"": 0.00019562160424025995}",PRUNED
21,0.06620033701249572,2026-09-25 14:59:27.596064,2026-09-25 15:00:11.576819,0 days 00:00:43.980755,32,32,standard,0.15219849167778776,0.0021702389029915428,0.00011176836722609531,,,,,,,,"{""base_channels"": 32, ""batch_size"": 32, ""channel_plan"": ""standard"", ""dropout"": 0.15219849167778776, ""lr"": 0.0021702389029915428, ""weight_decay"": 0.00011176836722609531}",PRUNED
22,0.005435033442809378,2026-09-25 15:00:52.295036,2026-09-25 15:01:50.475624,0 days 00:00:58.180588,16,32,shallow,0.1810582585265165,0.0003754948960496151,0.0016377089208453601,,7.0,58.1,0.9945651888847351,0.024319948628544807,0.9945649665571906,,"{""base_channels"": 16, ""batch_size"": 32, ""channel_plan"": ""shallow"", ""dropout"": 0.1810582585265165, ""lr"": 0.0003754948960496151, ""weight_decay"": 0.0016377089208453601}",COMPLETE
23,0.011215621572514989,2026-09-25 15:01:50.659519,2026-09-25 15:02:35.210967,0 days 00:00:44.551448,16,32,shallow,0.00663411156380443,0.0005337141368405409,0.004199281721104974,,,,,,,,"{""base_channels"": 16, ""batch_size"": 32, ""channel_plan"": ""shallow"", ""dropout"": 0.00663411156380443, ""lr"": 0.0005337141368405409, ""weight_decay"": 0.004199281721104974}",PRUNED
24,0.019057552815976986,2026-09-25 15:03:15.924580,2026-09-25 15:03:53.841022,0 days 00:00:37.916442,16,32,shallow,0.12736913387265927,0.0005037934955892285,0.008722371497828584,,,,,,,,"{""base_channels"": 16, ""batch_size"": 32, ""channel_plan"": ""shallow"", ""dropout"": 0.12736913387265927, ""lr"": 0.0005037934955892285, ""weight_decay"": 0.008722371497828584}",PRUNED
